{
  "$schema": "http://json-schema.org/draft-07/schema#",
  "$id": "https://crew.dev/contracts/report.v1.schema.json",
  "title": "crew.report/v1",
  "type": "object",
  "additionalProperties": false,
  "required": ["schema", "task_id", "run_id", "status", "summary"],
  "properties": {
    "schema": { "const": "crew.report/v1" },
    "task_id": { "type": "string", "pattern": "^tsk_[0-9A-Z]{26}$" },
    "run_id": { "type": "string", "pattern": "^run_[0-9A-Z]{26}$" },
    "status": {
      "type": "string",
      "enum": ["done", "failed", "blocked", "needs_input", "progress"]
    },
    "summary": { "type": "string", "minLength": 1, "maxLength": 4000 },
    "details": { "type": "string", "maxLength": 20000 },
    "tests": {
      "type": "array",
      "maxItems": 100,
      "items": {
        "type": "object",
        "additionalProperties": false,
        "required": ["command", "status"],
        "properties": {
          "command": { "type": "string", "minLength": 1, "maxLength": 2000 },
          "status": {
            "type": "string",
            "enum": ["passed", "failed", "skipped", "unknown"]
          },
          "duration_ms": { "type": "number", "minimum": 0 },
          "output": { "type": "string", "maxLength": 10000 }
        }
      }
    },
    "artifacts": {
      "type": "array",
      "maxItems": 100,
      "items": {
        "type": "object",
        "additionalProperties": false,
        "required": ["kind", "ref"],
        "properties": {
          "kind": {
            "type": "string",
            "enum": ["commit", "pr", "file", "url", "other"]
          },
          "ref": { "type": "string", "minLength": 1, "maxLength": 2000 },
          "label": { "type": "string", "maxLength": 500 }
        }
      }
    },
    "questions": {
      "type": "array",
      "maxItems": 50,
      "items": {
        "type": "object",
        "additionalProperties": false,
        "required": ["id", "text"],
        "properties": {
          "id": { "type": "string", "minLength": 1, "maxLength": 200 },
          "text": { "type": "string", "minLength": 1, "maxLength": 4000 },
          "blocking": { "type": "boolean" }
        }
      }
    },
    "follow_ups": {
      "type": "array",
      "maxItems": 50,
      "items": { "type": "string", "minLength": 1, "maxLength": 2000 }
    }
  }
}
